id,timestamp_utc,local_time,user_screen_name,text,possibly_sensitive,retweet_count,like_count,reply_count,lang,to_username,to_userid,to_tweetid,source_name,source_url,user_location,lat,lng,user_id,user_name,user_verified,user_description,user_url,user_image,user_tweets,user_followers,user_friends,user_likes,user_lists,user_created_at,user_timestamp_utc,collected_via,match_query,retweeted_id,retweeted_user,retweeted_user_id,retweeted_timestamp_utc,quoted_id,quoted_user,quoted_user_id,quoted_timestamp_utc,collection_time,url,place_country_code,place_name,place_type,place_coordinates,links,domains,media_urls,media_files,media_types,media_alt_texts,mentioned_names,mentioned_ids,hashtags
1652237222245027841,1682759025,2023-04-29T09:03:45,LudwigHermann,"@HerbertLackner1 @mayer_wolfgang Die Forderung, dass die SPÖ in die Falle einer 3-er Koalition mit FPÖVP geht, ist wahrlich grotesk. Welche Aufgaben könnte Haslauer nicht auch in einer 2-er Koalition lösen? Welche Gräben will jemand glätten, der dauernd neue Gräben gräbt wie FPÖVP.",0,0,5,0,de,HerbertLackner1,700911980,1652218052426059777,,,"Vienna, Austria",,,1917165840,@ludwighermann,0,"""Pessimism of the intellect, optimism of the will"" (R. Rolland and A. Gramsci) seems to be a good motto for not giving up pursuance of improvement.",http://www.proman.pro,https://pbs.twimg.com/profile_images/378800000524418538/110262ecfa8ecdd587f91c4f1ad530b6_normal.jpeg,2469,242,166,,3,2013-09-29T14:00:09,1380463209,,1,,,,,,,,,2023-05-02T10:31:01.731940,https://twitter.com/LudwigHermann/status/1652237222245027841,,,,,,,,,,,HerbertLackner1|mayer_wolfgang,700911980|360559977,
1652237100991782914,1682758996,2023-04-29T09:03:16,promussas,LH Haslauer plant eine Koalition mit der FPÖ: Damit sind Hetze und Ausgrenzung von Minderheiten in Salzburg vorprogrammiert. Deshalb fordern wir von Haslauer und der ÖVP Salzburg: Keine Koalition mit der FPÖ! Unterzeichne jetzt auch du https://actions.aufstehn.at/fpoesbg?source=share-tw via @aufstehnat,0,0,0,0,de,,,,,,,,,1281977692653522949,Lobby4kids,0,"Pharmazeutin, Mutter einer Tochter mit seltener Erkrankung und eines Sohnes ohne, Gründerin und Vorsitzende von Lobby4kids, freie Redakteurin",http://www.lobby4kids.at,https://pbs.twimg.com/profile_images/1613850170541629440/jok58kB3_normal.jpg,157,45,85,,0,2020-07-11T15:45:42,1594482342,,1,,,,,,,,,2023-05-02T10:31:01.732138,https://twitter.com/promussas/status/1652237100991782914,,,,,https://actions.aufstehn.at/fpoesbg?source=share-tw,,,,,,aufstehnat,2951645097,
1652236259367038978,1682758795,2023-04-29T08:59:55,SusannePscheidl,"@TiniHoWie2 Die Bedenkzeit ist aber sehr gnädig vom Landesherrn. Dass die SPÖ dem nicht zustimmt war Haslauer natürlich klar. Sie wäre nur das Feigenblättchen für Schwarz/Blau gewesen. Es zeigt aber auch die innerparteiliche Schwäche des Landeshauptmanns, der sich nicht gegen die Befürworter",0,0,0,1,de,TiniHoWie2,897772685987545088,1651905575607828482,,,"Wien, Österreich",,,981518557229002752,Susanne Pscheidl,0,Überzeugte Europäerin mit Liebe zu meiner Heimatstadt Wien. Herz schlägt links. Wünsch mir eine gute Zukunft für meine Enkelinnen und alle Kinder die hier leben,,https://pbs.twimg.com/profile_images/1537339098360430593/PbrIZpgD_normal.jpg,10763,771,712,,1,2018-04-04T13:07:14,1522847234,,1,,,,,,,,,2023-05-02T10:31:01.732245,https://twitter.com/SusannePscheidl/status/1652236259367038978,,,,,,,,,,,TiniHoWie2,897772685987545088,
1652236018735538176,1682758738,2023-04-29T08:58:58,bauer_gernot,"@Andreas_Kovar Der Wählerwille - so es ihn gibt - will offenbar Schwarz-Blau. Schwarz-Rot hat er keine stabile Mehrheit gegeben. Die Neos hat er weggefegt. Mit der KPÖ eine Macht geschaffen, die nur Opposition will. Haslauer gehen die Optionen aus. Mit Schwarz-Blau zerstört er sein Vermächtnis.",0,0,1,0,de,Andreas_Kovar,146898524,1652234467379912704,,,Wien,,,1192112607689428993,Gernot Bauer,0,"profil-Journalist, Sa u. So Ruhetag.",http://www.profil.at,https://pbs.twimg.com/profile_images/1199433619816755202/NpuMVrz4_normal.jpg,1840,2345,695,,11,2019-11-06T16:13:04,1573056784,,1,,,,,,,,,2023-05-02T10:31:01.732338,https://twitter.com/bauer_gernot/status/1652236018735538176,,,,,,,,,,,Andreas_Kovar,146898524,
1652235756927066117,1682758676,2023-04-29T08:57:56,tomevolucion,"So soll es sein - #salzburg #Haslauer #WienerZeitung 
https://exxpress.at/linke-alarmiert-auch-in-salzburg-stehen-die-weichen-auf-schwarz-blau",1,0,0,0,de,,,,,,VorübergehendGlobale Toilette ,,,1441050120552914946,toS,0,Nobody stands above it,,https://pbs.twimg.com/profile_images/1486709560404443158/7tNzvgoT_normal.jpg,12085,129,132,,13,2021-09-23T14:42:31,1632408151,,1,,,,,,,,,2023-05-02T10:31:01.732480,https://twitter.com/tomevolucion/status/1652235756927066117,,,,,https://exxpress.at/linke-alarmiert-auch-in-salzburg-stehen-die-weichen-auf-schwarz-blau,,,,,,,,Haslauer|WienerZeitung|salzburg
1652235739109679104,1682758671,2023-04-29T08:57:51,EKliesspies,"RT @TomMayerEuropa: Man sollte sich hüten, den Salzburger LH wegen seines ungewöhnlichen Vorschlags der Dreierkoalition zu verurteilen. Koalition von ÖVP und SPÖ hätte nur eine Stimme Überhang im Landtag. Da müsste nur eine/r Abgeordnete/r abspringen, und die Regierung crasht https://www.derstandard.at/story/2000145958391/haslauer-gibt-der-spoe-bedenkzeit-fuer-salzburger-koalitionsverhandlungen",0,0,0,0,de,,,,,,"Wien, Österreich",,,3176482114,Elisabeth Kliesspies,0,Menschenfreundin,http://elisabethkliesspiess.wordpress.com,https://pbs.twimg.com/profile_images/1213443091971104768/-JqTImGE_normal.jpg,168070,811,387,,45,2015-04-17T12:07:53,1429272473,,1,1652219536010014721,TomMayerEuropa,547173846,1682754808,,,,,2023-05-02T10:31:01.732714,https://twitter.com/EKliesspies/status/1652235739109679104,,,,,,,,,,,TomMayerEuropa,547173846,
1652234467379912704,1682758368,2023-04-29T08:52:48,Andreas_Kovar,"@bauer_gernot Haslauer hat die Wahl. Er kann entscheiden wie in Jahrzehnten über ihn geurteilt werden wird. Wegbereiter der Autoritären oder ein typischer Vertreter der 2. Republik, Pest oder Bauweh.",0,0,2,1,de,bauer_gernot,1192112607689428993,1652205981529456642,,,Vienna,,,146898524,Andreas,1,"#ConstructivePolicies #PublicAffairs #Advocacy, MD @KovarPartners• #eParticipation, MD @eComitee• #ChildrensRights, VP @SOSKinderdorfAT, SBM @sos_children",http://www.kovarpartners.com,https://pbs.twimg.com/profile_images/1604951244476502017/tj1JUX-t_normal.jpg,44101,4443,3030,,126,2010-05-22T16:47:14,1274546834,,1,,,,,,,,,2023-05-02T10:31:01.732820,https://twitter.com/Andreas_Kovar/status/1652234467379912704,,,,,,,,,,,bauer_gernot,1192112607689428993,
1652234042861924352,1682758267,2023-04-29T08:51:07,HannesW61,@TiniHoWie2 @pete_1410 Nach dieser Logik müsste Haslauer eine Konzentrationsregierung mit aller im Landtag vertretenen Parteien bilden.,0,0,3,0,de,TiniHoWie2,897772685987545088,1651912081787035649,,,"Vienna, Austria ",,,1267044690978881542,Hannes W.,0,"'Störungen haben Vorrang' (R. Cohn). 
Deutsch-Trainer, Wien. 
Focus - Photographie & Philosophie & Snooker.",,https://pbs.twimg.com/profile_images/1550146634234880006/4a-Ytu3A_normal.jpg,16186,316,1025,,1,2020-05-31T10:47:27,1590922047,,1,,,,,,,,,2023-05-02T10:31:01.732911,https://twitter.com/HannesW61/status/1652234042861924352,,,,,,,,,,,TiniHoWie2|pete_1410,897772685987545088|1112596469389934592,
1652233887047639042,1682758230,2023-04-29T08:50:30,poslussny,"RT @bauer_gernot: @TomMayerEuropa Wäre ein interessantes Experiment. Offen wäre, wie die  Minderheits-Landesregierung aussehen würde. Würde Haslauer sie nur mit seinen Leuten besetzen? Oder bietet er den anderen Parteien an, Vorschläge für Landesräte zu machen? Oder holt er ein, zwei Neutrale dazu?",0,0,0,0,de,,,,,,"Wien, Österreich",,,2570455318,Doctor Feelgood,0,"#cardiovascularsurgery,#gerichtsgutachten,#jazz,#travel,#sports,#literature,#nature,history#,onthesunnysideofthestreet,#kuriergesundheitscoach,#italylove,",,https://pbs.twimg.com/profile_images/1493238721453379587/jN9Awqqv_normal.jpg,1176,124,1063,,0,2014-05-29T13:31:16,1401370276,,1,1652229553127927809,bauer_gernot,1192112607689428993,1682757197,,,,,2023-05-02T10:31:01.733081,https://twitter.com/poslussny/status/1652233887047639042,,,,,,,,,,,TomMayerEuropa|bauer_gernot,547173846|1192112607689428993,
1652229553127927809,1682757197,2023-04-29T08:33:17,bauer_gernot,"@TomMayerEuropa Wäre ein interessantes Experiment. Offen wäre, wie die  Minderheits-Landesregierung aussehen würde. Würde Haslauer sie nur mit seinen Leuten besetzen? Oder bietet er den anderen Parteien an, Vorschläge für Landesräte zu machen? Oder holt er ein, zwei Neutrale dazu?",0,1,2,1,de,TomMayerEuropa,547173846,1652221464790147079,,,Wien,,,1192112607689428993,Gernot Bauer,0,"profil-Journalist, Sa u. So Ruhetag.",http://www.profil.at,https://pbs.twimg.com/profile_images/1199433619816755202/NpuMVrz4_normal.jpg,1840,2345,695,,11,2019-11-06T16:13:04,1573056784,retweet,1,,,,,,,,,2023-05-02T10:31:01.733059,https://twitter.com/bauer_gernot/status/1652229553127927809,,,,,,,,,,,TomMayerEuropa,547173846,
1652233514291429376,1682758141,2023-04-29T08:49:01,grafkaroly,RT @ChrisMaier__: @Claus_Pandi Haslauer will sein Gesicht bewahren aber es wirkt schon alles sehr freundlich seitdem die Wahl geschlagen wurde zwischen ÖVP und FPÖ. Schwarz-Blau in Salzburg wäre wie in Niederösterreich lange einzementiert sollte es tatsächlich zustandekommen. https://twitter.com/ChrisMaier__/status/1652191526523379713/photo/1,0,0,0,0,de,,,,,,,,,1946244720,Stefan K,0,,,https://pbs.twimg.com/profile_images/1638186044997738498/beG1IRB7_normal.jpg,208215,586,1542,,11,2013-10-08T08:56:52,1381222612,,1,1652191526523379713,ChrisMaier__,997368973837701120,1682748130,,,,,2023-05-02T10:31:01.733343,https://twitter.com/grafkaroly/status/1652233514291429376,,,,,,,,,,,ChrisMaier__|Claus_Pandi,997368973837701120|219991963,
1652191526523379713,1682748130,2023-04-29T06:02:10,ChrisMaier__,@Claus_Pandi Haslauer will sein Gesicht bewahren aber es wirkt schon alles sehr freundlich seitdem die Wahl geschlagen wurde zwischen ÖVP und FPÖ. Schwarz-Blau in Salzburg wäre wie in Niederösterreich lange einzementiert sollte es tatsächlich zustandekommen. https://twitter.com/ChrisMaier__/status/1652191526523379713/photo/1,0,1,2,0,de,Claus_Pandi,219991963,1652190444023840769,,,"Wien, Österreich",,,997368973837701120,Christian Maier 🇺🇦,0,VOLLE SOLIDARITÄT MIT DER UKRAINE,,https://pbs.twimg.com/profile_images/1617976140815007744/-iZ8pQai_normal.jpg,19862,276,70,,1,2018-05-18T06:51:08,1526626268,retweet,1,,,,,,,,,2023-05-02T10:31:01.733315,https://twitter.com/ChrisMaier__/status/1652191526523379713,,,,,https://twitter.com/ChrisMaier__/status/1652191526523379713/photo/1,,,,,,Claus_Pandi,219991963,
1652233424713789441,1682758120,2023-04-29T08:48:40,Andreas_Kovar,"RT @bauer_gernot: Aller guten Dinge sind drei, dachte sich Salzburgs LH Haslauer. Die SPÖ will aber nicht die nützliche Idiotin der ÖVP spielen.  Schwarz-Rot u Schwarz-Rot-Grün sind nach wie vor möglich. Aber Schwarz-Blau ist wahrscheinlicher geworden. Bloß: mit welchem LH?
https://www.profil.at/Österreich/salzburg-nach-der-wahl-kommt-nun-schwarz-blau/402430448",0,0,0,0,de,,,,,,Vienna,,,146898524,Andreas,1,"#ConstructivePolicies #PublicAffairs #Advocacy, MD @KovarPartners• #eParticipation, MD @eComitee• #ChildrensRights, VP @SOSKinderdorfAT, SBM @sos_children",http://www.kovarpartners.com,https://pbs.twimg.com/profile_images/1604951244476502017/tj1JUX-t_normal.jpg,44101,4443,3030,,126,2010-05-22T16:47:14,1274546834,,1,1652205981529456642,bauer_gernot,1192112607689428993,1682751577,,,,,2023-05-02T10:31:01.733661,https://twitter.com/Andreas_Kovar/status/1652233424713789441,,,,,,,,,,,bauer_gernot,1192112607689428993,
1652205981529456642,1682751577,2023-04-29T06:59:37,bauer_gernot,"Aller guten Dinge sind drei, dachte sich Salzburgs LH Haslauer. Die SPÖ will aber nicht die nützliche Idiotin der ÖVP spielen.  Schwarz-Rot u Schwarz-Rot-Grün sind nach wie vor möglich. Aber Schwarz-Blau ist wahrscheinlicher geworden. Bloß: mit welchem LH?
https://www.profil.at/Österreich/salzburg-nach-der-wahl-kommt-nun-schwarz-blau/402430448",0,2,17,3,de,,,,,,Wien,,,1192112607689428993,Gernot Bauer,0,"profil-Journalist, Sa u. So Ruhetag.",http://www.profil.at,https://pbs.twimg.com/profile_images/1199433619816755202/NpuMVrz4_normal.jpg,1840,2345,695,,11,2019-11-06T16:13:04,1573056784,retweet,1,,,,,,,,,2023-05-02T10:31:01.733634,https://twitter.com/bauer_gernot/status/1652205981529456642,,,,,https://www.profil.at/%C3%96sterreich/salzburg-nach-der-wahl-kommt-nun-schwarz-blau/402430448,,,,,,,,
1652233050623733760,1682758030,2023-04-29T08:47:10,KarDou12,"RT @z_abfalter: Mikl-Leitner sagt vor der Wahl: „auf keinen Fall mit der FPÖ!“ und macht nach der Wahl MIT der FPÖ!
Haslauer sagt vor der Wahl: „auf keinen Fall mit der FPÖ!“ und macht nach der Wahl MIT der FPÖ!
UND IMMER IST DIE SPÖ SCHULD DARAN!
Und Ihr sollt das wissen!",0,0,0,0,de,,,,,,Kärnten,,,1087100490607984641,Karin Doujak,0,"#Vertraue der Wissenschaft ❤️
#Gegen Ausgrenzung, Hass, Hetze
#WasteManagementBedrock
#StandWithUkraine",,https://pbs.twimg.com/profile_images/1471835071149748230/mJ6Vg5Ec_normal.jpg,63625,914,1666,,19,2019-01-20T21:32:09,1548019929,,1,1651844681204989955,z_abfalter,4652224697,1682665436,,,,,2023-05-02T10:31:01.733847,https://twitter.com/KarDou12/status/1652233050623733760,,,,,,,,,,,z_abfalter,4652224697,
1652232501396381697,1682757899,2023-04-29T08:44:59,TraudePinter,"RT @z_abfalter: Mikl-Leitner sagt vor der Wahl: „auf keinen Fall mit der FPÖ!“ und macht nach der Wahl MIT der FPÖ!
Haslauer sagt vor der Wahl: „auf keinen Fall mit der FPÖ!“ und macht nach der Wahl MIT der FPÖ!
UND IMMER IST DIE SPÖ SCHULD DARAN!
Und Ihr sollt das wissen!",0,0,0,0,de,,,,,,,,,828279721385398275,Traude Pinter,0,"Nimm Dich der Wahrheit an, wenn Du kannst und laß Dich gerne ihretwegen hassen!",,https://pbs.twimg.com/profile_images/1149305970830565377/5Is0vGUg_normal.png,68982,791,1718,,4,2017-02-05T16:30:49,1486312249,,1,1651844681204989955,z_abfalter,4652224697,1682665436,,,,,2023-05-02T10:31:01.734017,https://twitter.com/TraudePinter/status/1652232501396381697,,,,,,,,,,,z_abfalter,4652224697,
1652231387972345857,1682757634,2023-04-29T08:40:34,RUKO_2013,"Haslauer lässt Türe für die SPÖ noch offen https://www.krone.at/2993683 
Parteien, die andere ausgrenzen, haben in Regierungen nichts verloren. Deshalb ein klares Nein zur SPÖ und den Grünen.",0,0,0,0,de,,,,,,,,,2182838486,Rudolf Kolba,0,,,https://pbs.twimg.com/profile_images/1480196369528897541/QS-lYMhg_normal.jpg,2666,16,28,,0,2013-11-08T20:00:02,1383940802,,1,,,,,,,,,2023-05-02T10:31:01.734159,https://twitter.com/RUKO_2013/status/1652231387972345857,,,,,https://www.krone.at/2993683,,,,,,,,
1652230679290171392,1682757465,2023-04-29T08:37:45,dederreda,"@Claus_Pandi Wenn Haslauer mit der FPÖ eine Koalition bildet, hat er seine Wähler und Wählerinnen, die ihn deswegen nicht gewählt hätten, vor der Wahl bewusst belogen und betrogen.",0,0,0,0,de,Claus_Pandi,219991963,1652190444023840769,,, Österreich,,,854663619791007748,dederreda,0,Expertin für allzu Menschliches,https://twitter.com/search?q=from%3A%40dederreda%20-filter%3Areplies&s=09,https://pbs.twimg.com/profile_images/1446184629942300682/SwxtC9uo_normal.jpg,12319,1303,696,,6,2017-04-19T11:51:00,1492602660,,1,,,,,,,,,2023-05-02T10:31:01.734261,https://twitter.com/dederreda/status/1652230679290171392,,,,,,,,,,,Claus_Pandi,219991963,
1652229743402532864,1682757242,2023-04-29T08:34:02,DerRandomTuep,"@michdanninger @svazek @aufstehnat Und Haslauer kennt viele, die wegen Korruption vor Gericht stehen bzw. standen.

Es gilt natürlich immer die Unschuldsvermutung😏",0,0,2,0,de,michdanninger,724626638441459712,1651979867812921344,,,,,,1502579945159147521,Max 🇵🇱 🤍 🇺🇿,0,E N R O S A D I R A,,https://pbs.twimg.com/profile_images/1653105383429267487/-T7KDwDs_normal.jpg,6284,963,1131,,10,2022-03-12T09:39:26,1647077966,,1,,,,,,,,,2023-05-02T10:31:01.734351,https://twitter.com/DerRandomTuep/status/1652229743402532864,,,,,,,,,,,aufstehnat|michdanninger|svazek,2951645097|724626638441459712|1131147129215508480,
1652229647726174209,1682757219,2023-04-29T08:33:39,PeterLichtenbe2,"RT @michdanninger: Mit @svazek steht eine Person an der Spitze der FPÖ-Sbg, die enge Kontakte zu rechtsextremen Identitären pflegt – dennoch plant LH Haslauer eine schwarz-blaue Koalition. Nicht mit uns: Keine Koalition mit der FPÖ! Jetzt unterzeichnen: https://actions.aufstehn.at/fpoesbg?source=share-tw via @aufstehnat",0,0,0,0,de,,,,,,Lienz,,,1274239937844568064,Peter Lichtenberger,0,,,https://pbs.twimg.com/profile_images/1274240629296500737/lVCLKnqq_normal.jpg,2078,141,151,,0,2020-06-20T07:17:57,1592637477,,1,1651979867812921344,michdanninger,724626638441459712,1682697667,,,,,2023-05-02T10:31:01.734610,https://twitter.com/PeterLichtenbe2/status/1652229647726174209,,,,,,,,,,,michdanninger|svazek,724626638441459712|1131147129215508480,
1652228807938527232,1682757019,2023-04-29T08:30:19,Waldohreule303,"@Claus_Pandi @volkspartei Wenn Haslauer weiter zu machen gedenkt macht er schwarz rot, grün. Es scheint, er fliegt aus dem Chefsessel. Schnöll ist ein Intimus von Kurz. Mehr muss man nicht wissen. Die Bambitotschieß Fraktion wird sich durchsetzen.",0,0,0,0,de,Claus_Pandi,219991963,1652218040593833984,,,Österreich,,,237731150,Pia W.,0,"MenschIn, kritisch, direkt, antirechts, aber gerecht. Furchtlos und demokratisch.",,https://pbs.twimg.com/profile_images/1623767034977812486/pU3ARcJ5_normal.jpg,15977,155,154,,1,2011-01-13T14:08:31,1294927711,,1,,,,,,,,,2023-05-02T10:31:01.734807,https://twitter.com/Waldohreule303/status/1652228807938527232,,,,,,,,,,,Claus_Pandi|volkspartei,219991963|11043512,
1652228096714592256,1682756849,2023-04-29T08:27:29,heinzkollmann,@isabelledaniel Bürgermeister aus den Salzburger Gemeinden machen offenbar großen Druck Richtung Schwarz-Blau. Salzburg war schon immer ein Biotop für rechts. Haslauer wird bei dem Gedanken vermutlich übel. Ein Rücktritt - „Platz für Neues“ - in absehbarer Zeit würde mich nicht überraschen,0,0,0,1,de,isabelledaniel,89947367,1652225626638565378,,,Österreich,,,24579254,Heinz Kollmann,0,"Arzt, jahrzehntelang Maskenträger, dreifach geimpft! Beobachter, liberal, nicht immer neutral. Carpe diem - denn das Leben ist Entropie.",,https://pbs.twimg.com/profile_images/1384038225157627904/U16jEysp_normal.jpg,15476,256,186,,3,2009-03-15T20:23:30,1237148610,,1,,,,,,,,,2023-05-02T10:31:01.734894,https://twitter.com/heinzkollmann/status/1652228096714592256,,,,,,,,,,,isabelledaniel,89947367,
1652227663514181633,1682756746,2023-04-29T08:25:46,scherer_rupert,"RT @z_abfalter: Mikl-Leitner sagt vor der Wahl: „auf keinen Fall mit der FPÖ!“ und macht nach der Wahl MIT der FPÖ!
Haslauer sagt vor der Wahl: „auf keinen Fall mit der FPÖ!“ und macht nach der Wahl MIT der FPÖ!
UND IMMER IST DIE SPÖ SCHULD DARAN!
Und Ihr sollt das wissen!",0,0,0,0,de,,,,,,"München, Bayern",,,750431622139437057,Trepur Scissors,0,"ich werde nun trollen. ich bin meine  eigene Trollarmee. aus aktuellen Anlass, den Namen verschlüsselt.
twittere über alles und kommentiere gerne",,https://pbs.twimg.com/profile_images/1592946045381656577/CGH0HQzv_normal.jpg,8924,36,153,,1,2016-07-05T20:50:15,1467751815,,1,1651844681204989955,z_abfalter,4652224697,1682665436,,,,,2023-05-02T10:31:01.735052,https://twitter.com/scherer_rupert/status/1652227663514181633,,,,,,,,,,,z_abfalter,4652224697,
1652226473854394369,1682756462,2023-04-29T08:21:02,isabelledaniel,"@TomMayerEuropa Tom, du bist ein bisserl besessen von PRW ;) aber dort geht es echt nicht um sie. Da geht es jetzt echt um Landesgruppe. Halte Schwarz–Rot eh für ausgeschlossen. Schwarz–Rot–Grün würde Haslauer in eigener Partei nicht durchbekommen. Also läuft es wohl auf Schwarz–Blau hinaus.",0,0,3,1,de,TomMayerEuropa,547173846,1652225399227576321,,,"Vienna, Austria",,,89947367,Isabelle Daniel,0,Journalist.,http://www.oe24.at,https://pbs.twimg.com/profile_images/966217603306999808/9x-taz9N_normal.jpg,50497,45906,922,,502,2009-11-14T14:35:41,1258209341,,1,,,,,,,,,2023-05-02T10:31:01.735143,https://twitter.com/isabelledaniel/status/1652226473854394369,,,,,,,,,,,TomMayerEuropa,547173846,
1652226116210270209,1682756377,2023-04-29T08:19:37,PNemschak,@exxpressat Es liegt an den Linken und Grünen mit Haslauer zu kooperieren statt sich über schwarz-blau zu erregen.,0,0,2,2,de,exxpressat,1380507205867335680,1652211576110235651,,,,,,974204055592595456,Peter Nemschak,0,,,https://pbs.twimg.com/profile_images/974208036238749696/SnCJrTzx_normal.jpg,64897,328,73,,13,2018-03-15T08:42:01,1521103321,,1,,,,,,,,,2023-05-02T10:31:01.735227,https://twitter.com/PNemschak/status/1652226116210270209,,,,,,,,,,,exxpressat,1380507205867335680,
1652225778732417024,1682756297,2023-04-29T08:18:17,FHabersberger,"@TomMayerEuropa Wenn ich daran denke, was die Gegenmehrheit aus SPÖ, FPÖ & KPÖ alles beschließen würde, hoffe ich darauf, dass Haslauer eine Koalition eingeht.",0,0,5,1,de,TomMayerEuropa,547173846,1652224910968647686,,,,,,771312801218297856,Florian Habersberger 🇺🇦🇺🇸🇪🇺,0,"Themen: Marktliberalismus, Gesundheits- & Pensionssysteme, Kammern",,https://pbs.twimg.com/profile_images/1208327377954181120/MSHwHdhT_normal.jpg,36288,1860,304,,7,2016-09-01T11:44:36,1472730276,,1,,,,,,,,,2023-05-02T10:31:01.735315,https://twitter.com/FHabersberger/status/1652225778732417024,,,,,,,,,,,TomMayerEuropa,547173846,
1652225649422000128,1682756266,2023-04-29T08:17:46,rudolf_hack,"RT @ziegler_rob: Haslauer gibt der SPÖ Bedenkzeit für Salzburger Koalitionsverhandlungen https://www.derstandard.at/story/2000145958391/haslauer-gibt-der-spoe-bedenkzeit-fuer-salzburger-koalitionsverhandlungen?ref=article 

Heuchelei hat einen Namen: Haslauer!",0,0,0,0,de,,,,,,"Gänserndorf, Österreich",,,1546962501274931201,Rudolf Hack,0,Gerechtigkeit und Ehrlichkeit liebender Sozialdemokrat,,https://pbs.twimg.com/profile_images/1547624354183204866/me3MLJ4J_normal.jpg,1611,292,896,,0,2022-07-12T21:01:47,1657659707,,1,1651874378974478338,ziegler_rob,1484739320,1682672516,,,,,2023-05-02T10:31:01.735832,https://twitter.com/rudolf_hack/status/1652225649422000128,,,,,https://www.derstandard.at/story/2000145958391/haslauer-gibt-der-spoe-bedenkzeit-fuer-salzburger-koalitionsverhandlungen?ref=article,,,,,,ziegler_rob,1484739320,
1651874378974478338,1682672516,2023-04-28T09:01:56,ziegler_rob,"Haslauer gibt der SPÖ Bedenkzeit für Salzburger Koalitionsverhandlungen https://www.derstandard.at/story/2000145958391/haslauer-gibt-der-spoe-bedenkzeit-fuer-salzburger-koalitionsverhandlungen?ref=article 

Heuchelei hat einen Namen: Haslauer!",0,11,39,9,de,,,,,,"Vienna, Austria, Europe, World",,,1484739320,Robert Ziegler,0,"es ist, wie´s ist; alles easy; immer freundlich bleiben.",,https://pbs.twimg.com/profile_images/1365604761496662016/uZkiEuxZ_normal.jpg,19701,309,294,,2,2013-06-05T11:06:09,1370430369,retweet,1,,,,,,,,,2023-05-02T10:31:01.735551,https://twitter.com/ziegler_rob/status/1651874378974478338,,,,,https://www.derstandard.at/story/2000145958391/haslauer-gibt-der-spoe-bedenkzeit-fuer-salzburger-koalitionsverhandlungen?ref=article,,,,,,,,
1652225626638565378,1682756260,2023-04-29T08:17:40,isabelledaniel,"In der ÖVP ist es übrigens ähnlich wie in der SPÖ. Die Mittelbaufunktionäre wollen keine Kooperation mit der jeweils anderen Partei. Insofern versuchte Haslauer diese seltsam anmutende Dreier–Koalition vielleicht auch, um seine eigene „Basis“ zu beruhigen.",0,0,3,2,de,,,,,,"Vienna, Austria",,,89947367,Isabelle Daniel,0,Journalist.,http://www.oe24.at,https://pbs.twimg.com/profile_images/966217603306999808/9x-taz9N_normal.jpg,50497,45906,922,,502,2009-11-14T14:35:41,1258209341,,1,,,,,,,,,2023-05-02T10:31:01.735953,https://twitter.com/isabelledaniel/status/1652225626638565378,,,,,,,,,,,,,
1652225399227576321,1682756206,2023-04-29T08:16:46,TomMayerEuropa,"@isabelledaniel Ich sehe das genau umgekehrt: Kein Mensch weiß heute, was aus der SPÖ wird. Vielleicht zerreißt es sie in den kommenden Wochen an Rendi-Wagner! Glaubt ja wohl keiner, dass es mit ihr plötzlich super weiterlaufen würde. Wäre ich Haslauer, würde ich auf SPÖ allein auch nicht bauen.",0,0,1,2,de,isabelledaniel,89947367,1652221253564989440,,,Bruxelles,,,547173846,Thomas Mayer,0,"Gründungsmitglied von Der Standard, Europa/Nato-Korrespondent, zwitschere privat. Österreich ist meine Heimat, Brüssel meine Stadt, an vielen Orten zu Hause",https://derStandard.at,https://pbs.twimg.com/profile_images/2093006049/twitterfoto2_normal.jpg,133255,42608,1349,,690,2012-04-06T20:36:32,1333744592,,1,,,,,,,,,2023-05-02T10:31:01.736098,https://twitter.com/TomMayerEuropa/status/1652225399227576321,,,,,,,,,,,isabelledaniel,89947367,
1652224910968647686,1682756090,2023-04-29T08:14:50,TomMayerEuropa,"@FHabersberger Minderheitsregierungen sind nie einfach! Viel Arbeit. Aber im Gegenzug hätte Haslauer einen Trumpf in der Hand: Wenn die Opposition ihn ständig blockiert oder stürzt, gibt es eben wieder Neuwahlen. Und wenn Haslauer seine Sache gut machte, würde er die Wahlen hoch gewinnen.",0,0,3,2,de,FHabersberger,771312801218297856,1652223708872814593,,,Bruxelles,,,547173846,Thomas Mayer,0,"Gründungsmitglied von Der Standard, Europa/Nato-Korrespondent, zwitschere privat. Österreich ist meine Heimat, Brüssel meine Stadt, an vielen Orten zu Hause",https://derStandard.at,https://pbs.twimg.com/profile_images/2093006049/twitterfoto2_normal.jpg,133255,42608,1349,,690,2012-04-06T20:36:32,1333744592,,1,,,,,,,,,2023-05-02T10:31:01.736197,https://twitter.com/TomMayerEuropa/status/1652224910968647686,,,,,,,,,,,FHabersberger,771312801218297856,
