id,timestamp_utc,local_time,user_screen_name,text,possibly_sensitive,retweet_count,like_count,reply_count,lang,to_username,to_userid,to_tweetid,source_name,source_url,user_location,lat,lng,user_id,user_name,user_verified,user_description,user_url,user_image,user_tweets,user_followers,user_friends,user_likes,user_lists,user_created_at,user_timestamp_utc,collected_via,match_query,retweeted_id,retweeted_user,retweeted_user_id,retweeted_timestamp_utc,quoted_id,quoted_user,quoted_user_id,quoted_timestamp_utc,collection_time,url,place_country_code,place_name,place_type,place_coordinates,links,domains,media_urls,media_files,media_types,media_alt_texts,mentioned_names,mentioned_ids,hashtags
1652307262449303553,1682775724,2023-04-29T13:42:04,BineBee_tweets,"@MarkelGerald Meisterwerk? Geh bitte. Spätestens seit NÖ so durchschaubar. Haslauer will die FPÖ - wie es geht hat ihm Parteikollegin Mikl Leitner in NÖ vorgezeigt. Und wie in NÖ braucht die ÖVP jetzt einen Schuldigen, dass sie mit der „bösen“ FPÖ paktiert. So deppert ist der Wähler wieder net",0,0,5,2,de,MarkelGerald,822774456951144450,1652213404814147590,,,,,,825410336673116166,BineBee,0,,,https://abs.twimg.com/sticky/default_profile_images/default_profile_normal.png,288,19,369,,0,2017-01-28T18:28:54,1485628134,,1,,,,,,,,,2023-05-02T10:31:00.366396,https://twitter.com/BineBee_tweets/status/1652307262449303553,,,,,,,,,,,MarkelGerald,822774456951144450,
1652306470715768833,1682775535,2023-04-29T13:38:55,mayer_wolfgang,"RT @TomMayerEuropa: Man sollte sich hüten, den Salzburger LH wegen seines ungewöhnlichen Vorschlags der Dreierkoalition zu verurteilen. Koalition von ÖVP und SPÖ hätte nur eine Stimme Überhang im Landtag. Da müsste nur eine/r Abgeordnete/r abspringen, und die Regierung crasht https://www.derstandard.at/story/2000145958391/haslauer-gibt-der-spoe-bedenkzeit-fuer-salzburger-koalitionsverhandlungen",0,0,0,0,de,,,,,,,,,360559977,Wolfgang Mayer,0,,,https://pbs.twimg.com/profile_images/1169146222759862275/D07wSPCL_normal.jpg,4743,922,1527,,9,2011-08-23T12:04:45,1314101085,,1,1652219536010014721,TomMayerEuropa,547173846,1682754808,,,,,2023-05-02T10:31:00.366645,https://twitter.com/mayer_wolfgang/status/1652306470715768833,,,,,,,,,,,TomMayerEuropa,547173846,
1652304281180033024,1682775013,2023-04-29T13:30:13,HowardMarks710,"RT @Steirerin: Salzburger Sondierungsgespräche:
ÖVP + FPÖ + SPÖ? 
Haslauer weiß genau, dass sich die SPÖ auf diese absurde Kombination niemals einlässt. 
Fazit: Er kann sich vor aller Welt die Hände in Unschuld waschen und sagen: „Seht her, ich hab’s versucht, aber die SPÖ will ja nicht!“",0,0,0,0,de,,,,,,,,,1592847741436235776,AngryFella,0,,,https://pbs.twimg.com/profile_images/1649948445120118785/3hDWRr8A_normal.jpg,18958,754,3008,,5,2022-11-16T11:51:18,1668599478,,1,1652022568830812171,Steirerin,109529448,1682707848,,,,,2023-05-02T10:31:00.366832,https://twitter.com/HowardMarks710/status/1652304281180033024,,,,,,,,,,,Steirerin,109529448,
1652022568830812171,1682707848,2023-04-28T18:50:48,Steirerin,"Salzburger Sondierungsgespräche:
ÖVP + FPÖ + SPÖ? 
Haslauer weiß genau, dass sich die SPÖ auf diese absurde Kombination niemals einlässt. 
Fazit: Er kann sich vor aller Welt die Hände in Unschuld waschen und sagen: „Seht her, ich hab’s versucht, aber die SPÖ will ja nicht!“",0,13,97,25,de,,,,,,"Graz, Österreich",,,109529448,Monika M.🔴🇺🇦Benji🌈+ Molly🌈+ Fesy🌈,0,"„Love is always bestowed as a gift - freely, willingly and without expectation.We don‘t love to be loved; we love to love.“🐶#VEGAN",,https://pbs.twimg.com/profile_images/1481656916950482948/j_4Kb6dP_normal.jpg,52232,1428,1300,,10,2010-01-29T10:47:34,1264762054,retweet,1,,,,,,,,,2023-05-02T10:31:00.366809,https://twitter.com/Steirerin/status/1652022568830812171,,,,,,,,,,,,,
1652303369359306754,1682774796,2023-04-29T13:26:36,doncarlos332,"Mit @svazek steht eine Person an der Spitze der FPÖ-Sbg, die enge Kontakte zu rechtsextremen Identitären pflegt – dennoch plant LH Haslauer eine schwarz-blaue Koalition. Nicht mit uns: Keine Koalition mit der FPÖ! Jetzt unterzeichnen: https://actions.aufstehn.at/fpoesbg?source=share-tw via @aufstehnat",0,0,0,0,de,,,,,,,,,1277767304898588672,don carlos 33 (schererandi) 🌈☮🧡,0,"offen für alle und alles, seit jeher Rot/Grün, derzeit jedoch ROT und kein Grün mehr",,https://pbs.twimg.com/profile_images/1631331457099526144/tOzTpOCj_normal.png,63501,276,318,,2,2020-06-30T00:54:45,1593478485,,1,,,,,,,,,2023-05-02T10:31:00.367001,https://twitter.com/doncarlos332/status/1652303369359306754,,,,,https://actions.aufstehn.at/fpoesbg?source=share-tw,,,,,,aufstehnat|svazek,2951645097|1131147129215508480,
1652302688397283328,1682774633,2023-04-29T13:23:53,BineBee_tweets,"@alissa_claudia ÖVP- absolut durchschaubar.  Haslauer koaliert mit der FPÖ - wie es geht hat ihm Parteikollegin Mikl Leitner in NÖ vorgezeigt. Und wie in NÖ braucht die ÖVP jetzt Schuldigen, dass sie mit der „bösen“ FPÖ paktieren. 
So durchschaubar.",0,0,2,0,de,alissa_claudia,1143039246,1652248083948789760,,,,,,825410336673116166,BineBee,0,,,https://abs.twimg.com/sticky/default_profile_images/default_profile_normal.png,288,19,369,,0,2017-01-28T18:28:54,1485628134,,1,,,,,,,,,2023-05-02T10:31:00.367105,https://twitter.com/BineBee_tweets/status/1652302688397283328,,,,,,,,,,,alissa_claudia,1143039246,
1652299698668023810,1682773921,2023-04-29T13:12:01,vienna1011,"RT @Rosa_Sonnenhut: Rückgrat: Egger - SPÖ 
Kein Rückgrat: Haslauer - ÖVP",0,0,0,0,de,,,,,,"Wien, Österreich",,,53666782,Andrea Seidl🇺🇦,0,"DGKP a.d.Front, Wissenssammlerin, Humanistin u. Animal-rights-Verfechterin,Sozialdemokratin aus Überzeugung, Hasskommentare,Trolle u. Neonazis werden geblockt",,https://pbs.twimg.com/profile_images/1600898307009777665/oYhj1ECw_normal.jpg,38323,887,655,,3,2009-07-04T13:18:22,1246713502,,1,1651965657926311948,Rosa_Sonnenhut,994483447463890944,1682694279,,,,,2023-05-02T10:31:00.367275,https://twitter.com/vienna1011/status/1652299698668023810,,,,,,,,,,,Rosa_Sonnenhut,994483447463890944,
1651965657926311948,1682694279,2023-04-28T15:04:39,Rosa_Sonnenhut,"Rückgrat: Egger - SPÖ 
Kein Rückgrat: Haslauer - ÖVP",0,13,114,5,de,,,,,,,,,994483447463890944,Rosa Sonnenhut,0,"""Auch der Laubfrosch
quakt ihr zu:
""Du bist du!
Und wer das nicht weiss,
ist dumm!""
Bumm.""",,https://pbs.twimg.com/profile_images/1029746261962960896/aYTFA7b5_normal.jpg,108373,5291,1252,,20,2018-05-10T07:45:05,1525938305,retweet,1,,,,,,,,,2023-05-02T10:31:00.367254,https://twitter.com/Rosa_Sonnenhut/status/1651965657926311948,,,,,,,,,,,,,
1652298104282939394,1682773540,2023-04-29T13:05:40,heigion,"RT @kay_dankl: 1) Einige Ideen, die nicht besonders links sind & sogar für d. ÖVP umsetzbar wären: Das habe ich diese Woche beim Empfangsgespräch mit LH Haslauer mitgebracht. Es war ein respektvoller Austausch, auch wenn uns weltanschaulich & wohnungspolitisch sehr viel trennt. @krone_salzburg https://twitter.com/kay_dankl/status/1652267890731515905/photo/1",0,0,0,0,de,,,,,,,,,2340812917,heifi #18er,0,"im Unruhestand, aber nicht uninteressiert",,https://pbs.twimg.com/profile_images/1417941225454415872/fWy0z-Wt_normal.jpg,194326,1992,2435,,32,2014-02-12T19:09:26,1392232166,,1,1652267890731515905,kay_dankl,84951490,1682766337,,,,,2023-05-02T10:31:00.367662,https://twitter.com/heigion/status/1652298104282939394,,,,,,,,,,,kay_dankl,84951490,
1652295906597785600,1682773016,2023-04-29T12:56:56,Edith41209888,LH Haslauer möchte mit der FPÖ koalieren. Ein weiterer schwarz-blauer Pakt in AT. Für die #NRW24 verheißt das nichts Gutes. Wir fordern von Haslauer und der ÖVP Salzburg: Keine Koalition mit der FPÖ! Unterzeichne jetzt auch du https://actions.aufstehn.at/fpoesbg?source=share-tw via @aufstehnat,0,0,0,0,de,,,,,,,,,1361054648799547395,Edith,0,,,https://pbs.twimg.com/profile_images/1633251048012804097/pdeTetpc_normal.jpg,5955,107,32,,0,2021-02-14T20:48:30,1613335710,,1,,,,,,,,,2023-05-02T10:31:00.367841,https://twitter.com/Edith41209888/status/1652295906597785600,,,,,https://actions.aufstehn.at/fpoesbg?source=share-tw,,,,,,aufstehnat,2951645097,NRW24
1652295510185615368,1682772922,2023-04-29T12:55:22,Dunlopinlop,"RT @RobertSchalle11: Haslauer strebt in Salzburg eine 3er Koalition mit SPÖ und FPÖ an. Sollte die SPÖ da nicht mitmachen, bleibt ihm leider nichts anderes übrig, als mit der FPÖ zu koalieren. So wie Mikl Leitner mit der FPÖ zusammengehen musste, weil Hergovich (SPÖ) unverschämte Forderungen stellte.",0,0,0,0,de,,,,,,,,,892686410066665473,Eva Klepp-Afritsch,0,freischaffende Künstlerin,,https://pbs.twimg.com/profile_images/1643315924844290049/k6dvIcP0_normal.jpg,9986,248,175,,0,2017-08-02T10:00:00,1501668000,,1,1651927259161214976,RobertSchalle11,1450866894219747331,1682685124,,,,,2023-05-02T10:31:00.368125,https://twitter.com/Dunlopinlop/status/1652295510185615368,,,,,,,,,,,RobertSchalle11,1450866894219747331,
1651927259161214976,1682685124,2023-04-28T12:32:04,RobertSchalle11,"Haslauer strebt in Salzburg eine 3er Koalition mit SPÖ und FPÖ an. Sollte die SPÖ da nicht mitmachen, bleibt ihm leider nichts anderes übrig, als mit der FPÖ zu koalieren. So wie Mikl Leitner mit der FPÖ zusammengehen musste, weil Hergovich (SPÖ) unverschämte Forderungen stellte.",0,8,38,7,de,,,,,,,,,1450866894219747331,Robert Schaller,0,"Durchschnittsbürger, Steuerzahler, Optimist, Fotograf.
Politisch gefestigt.",,https://pbs.twimg.com/profile_images/1465340663315275777/Q-Xea9I6_normal.jpg,451,1917,1855,,3,2021-10-20T16:52:04,1634748724,retweet,1,,,,,,,,,2023-05-02T10:31:00.368095,https://twitter.com/RobertSchalle11/status/1651927259161214976,,,,,,,,,,,,,
1652291147312578560,1682771882,2023-04-29T12:38:02,IngeHaus2,"RT @alissa_claudia: Sozis - absolut Lustigste.

Im Bund fallen sie grad über Grüne her, wohl zu recht, und gleichzeitig wollen sie Haslauer zwingen mit SPÖ und Grünen zu koalieren.

Grüne - im Bund Saulus, im Land Paulus. Gleichzeitig.",0,0,0,0,de,,,,,,,,,1299689982,Inge Haus,0,"Mit einer demokratischen Gesellschaft ist das Konzept von Multikulti schwer vereinbar. Helmut Schmidt, 2004     
#147sf 🇦🇹",,https://pbs.twimg.com/profile_images/1325553737486790659/lt31eE1A_normal.jpg,83719,2319,2503,,11,2013-03-25T14:28:07,1364221687,,1,1652248083948789760,alissa_claudia,1143039246,1682761615,,,,,2023-05-02T10:31:00.368327,https://twitter.com/IngeHaus2/status/1652291147312578560,,,,,,,,,,,alissa_claudia,1143039246,
1652289567486033920,1682771505,2023-04-29T12:31:45,WannerIris,"RT @mikeemesser: Die #Ostfriesenkoalition ist natürlich eine Falle von #Haslauer, in die die #SPÖ brav hineingetappt ist, weil sie jetzt wieder als Verhinderer dasteht.

Ich verstehe nicht, wie man auf dieses vergiftete Angebot so hilflos reagieren kann. Wenn einem das Framing nicht passt, ...",0,0,0,0,de,,,,,,,,,763321779813289984,Iris Wanner,0,#education #blendedlearning #ICT #newmedia #elearning #eparticipation #ehealth #mhealth #edemocracy,,https://pbs.twimg.com/profile_images/1122843472795402240/7o6qVDKi_normal.png,21053,1133,2158,,46,2016-08-10T10:31:08,1470825068,,1,1652283166437064705,mikeemesser,6485672,1682769979,,,,,2023-05-02T10:31:00.368559,https://twitter.com/WannerIris/status/1652289567486033920,,,,,,,,,,,mikeemesser,6485672,Haslauer|Ostfriesenkoalition|SPÖ
1652283166437064705,1682769979,2023-04-29T12:06:19,mikeemesser,"Die #Ostfriesenkoalition ist natürlich eine Falle von #Haslauer, in die die #SPÖ brav hineingetappt ist, weil sie jetzt wieder als Verhinderer dasteht.

Ich verstehe nicht, wie man auf dieses vergiftete Angebot so hilflos reagieren kann. Wenn einem das Framing nicht passt, ...",0,1,6,1,de,,,,,,"Vienna, Austria",,,6485672,𝔐𝔦𝔠𝔥𝔞𝔢𝔩 𝔈𝔦𝔰𝔢𝔫𝔯𝔦𝔢𝔤𝔩𝔢𝔯,0,"#Genealogie, (Online-) #Medien, #Journalismus, (Netz-) #Politik, #Mongolei, #Buddhismus, #SingleMalts, #AnalogueAudio.

@mikeemesser@mastodon.social",http://michael.eisenriegler.at,https://pbs.twimg.com/profile_images/1066456069499691008/R1HxEQfV_normal.jpg,15991,2195,1483,,101,2007-05-31T23:06:41,1180652801,retweet,1,,,,,,,,,2023-05-02T10:31:00.368532,https://twitter.com/mikeemesser/status/1652283166437064705,,,,,,,,,,,,,Haslauer|Ostfriesenkoalition|SPÖ
1652289531251392512,1682771496,2023-04-29T12:31:36,IrmiNovak,LH Haslauer plant eine Koalition mit der FPÖ: Damit sind Hetze und Ausgrenzung von Minderheiten in Salzburg vorprogrammiert. Deshalb fordern wir von Haslauer und der ÖVP Salzburg: Keine Koalition mit der FPÖ! Unterzeichne jetzt auch du https://actions.aufstehn.at/fpoesbg?source=share-tw via @aufstehnat,0,0,0,0,de,,,,,,Wien,,,1102564191599243264,Irmi Novak,0,"Publizistin | Umweltschützerin | Anti-AKW | #Feminismus | Gutmensch | politisch links der Mitte / #CleanEnergyWillWin /
Postwachstums-Ökonomie kann Leben retten",http://irminovak.wordpress.com/,https://pbs.twimg.com/profile_images/1102565170570772480/XL8N-8SI_normal.jpg,31753,359,782,,3,2019-03-04T13:39:22,1551706762,,1,,,,,,,,,2023-05-02T10:31:00.368804,https://twitter.com/IrmiNovak/status/1652289531251392512,,,,,https://actions.aufstehn.at/fpoesbg?source=share-tw,,,,,,aufstehnat,2951645097,
1652289249486446598,1682771429,2023-04-29T12:30:29,pogwoi,"@exxpressat Nein der Haslauerclan, bestehend aus Politkomponenten wie Haslauer-alt, Schausberger, Hans Zylla+ , ..... ist ein Fossil des schwarz-roten Packelstaates,  man bewältige alle Skandale gemeinsam, der rote Radlegger+ der alte Haslauer bei der WEB, und Burgstaller mit Haslauer ....",0,0,0,0,de,exxpressat,1380507205867335680,1652211576110235651,,,,,,2681644963,Anton Poigner,0,,,https://abs.twimg.com/sticky/default_profile_images/default_profile_normal.png,13067,158,341,,10,2014-07-26T07:07:54,1406358474,,1,,,,,,,,,2023-05-02T10:31:00.368929,https://twitter.com/pogwoi/status/1652289249486446598,,,,,,,,,,,exxpressat,1380507205867335680,
1652289236001779712,1682771426,2023-04-29T12:30:26,Betrifft,@fluglehrer Noch genauer: Haslauer will mit #FPÖ regieren!,0,0,1,2,de,fluglehrer,8954232,1652271935294717952,,,Österreich,,,319854904,Georg Karp,0,"Die Wahrheit ist ein Trick! Denn wahr ist nur die Lüge. Und wer die Wahrheit sagt, muss ein schnelles Pferd haben. Hast du eins? George is watching you!",https://TRAVELbusiness.at,https://pbs.twimg.com/profile_images/570990321295568896/ZwoFn_To_normal.jpeg,97280,1751,595,,143,2011-06-18T21:30:18,1308432618,,1,,,,,,,,,2023-05-02T10:31:00.369031,https://twitter.com/Betrifft/status/1652289236001779712,,,,,,,,,,,fluglehrer,8954232,FPÖ
1652287217933463555,1682770945,2023-04-29T12:22:25,saschaosaka,"RT @michdanninger: Mit @svazek steht eine Person an der Spitze der FPÖ-Sbg, die enge Kontakte zu rechtsextremen Identitären pflegt – dennoch plant LH Haslauer eine schwarz-blaue Koalition. Nicht mit uns: Keine Koalition mit der FPÖ! Jetzt unterzeichnen: https://actions.aufstehn.at/fpoesbg?source=share-tw via @aufstehnat",0,0,0,0,de,,,,,,"Vienna, Austria",,,54832478,Sascha Osaka 🖤,0,"Dad of 3 ♀+ 1 ♂! Bildung ist das einzige Mittel gegen die Rechten, darum verhindern diese immer noch eine Bildungsreform! ENJOY YOUR LIFE don't waste your time",http://osaka.at,https://pbs.twimg.com/profile_images/1468695312567083012/DYbKyugk_normal.jpg,53817,548,799,,19,2009-07-08T07:46:59,1247039219,,1,1651979867812921344,michdanninger,724626638441459712,1682697667,,,,,2023-05-02T10:31:00.369277,https://twitter.com/saschaosaka/status/1652287217933463555,,,,,,,,,,,michdanninger|svazek,724626638441459712|1131147129215508480,
1651979867812921344,1682697667,2023-04-28T16:01:07,michdanninger,"Mit @svazek steht eine Person an der Spitze der FPÖ-Sbg, die enge Kontakte zu rechtsextremen Identitären pflegt – dennoch plant LH Haslauer eine schwarz-blaue Koalition. Nicht mit uns: Keine Koalition mit der FPÖ! Jetzt unterzeichnen: https://actions.aufstehn.at/fpoesbg?source=share-tw via @aufstehnat",0,54,243,36,de,,,,,,Österreich,,,724626638441459712,MDanninger,0,"für eine faire Gesellschaft - for equity and social fairness, follow or RT ≠ endorsement",,https://pbs.twimg.com/profile_images/1490789066383806466/97S0tmLi_normal.jpg,29639,5080,5468,,13,2016-04-25T15:50:28,1461599428,retweet,1,,,,,,,,,2023-05-02T10:31:00.369249,https://twitter.com/michdanninger/status/1651979867812921344,,,,,https://actions.aufstehn.at/fpoesbg?source=share-tw,,,,,,aufstehnat|svazek,2951645097|1131147129215508480,
1652284356814163968,1682770263,2023-04-29T12:11:03,wohrer_t,@TomMayerEuropa Dann könnten ja Mikl-Leitner und Haslauer genauso gut mit der SPÖ zusammenarbeiten?! Ihr Hass auf die SPÖ ist peinlich,0,0,9,0,de,TomMayerEuropa,547173846,1652265844326498304,,,,,,1508496338719281154,Theres,0,"Garten, Hühner, Naturschutz, Allergie gegen Rechts",,https://pbs.twimg.com/profile_images/1508527247690551300/JuInN4h9_normal.jpg,6928,314,800,,1,2022-03-28T17:29:08,1648488548,,1,,,,,,,,,2023-05-02T10:31:00.369380,https://twitter.com/wohrer_t/status/1652284356814163968,,,,,,,,,,,TomMayerEuropa,547173846,
1652284259929817089,1682770240,2023-04-29T12:10:40,Holunderl,"RT @kay_dankl: 1) Einige Ideen, die nicht besonders links sind & sogar für d. ÖVP umsetzbar wären: Das habe ich diese Woche beim Empfangsgespräch mit LH Haslauer mitgebracht. Es war ein respektvoller Austausch, auch wenn uns weltanschaulich & wohnungspolitisch sehr viel trennt. @krone_salzburg https://twitter.com/kay_dankl/status/1652267890731515905/photo/1",0,0,0,0,de,,,,,,,,,791273386500616192,Lisa Lemberg,0,,,https://pbs.twimg.com/profile_images/1581267982096932864/jbR3YPVq_normal.jpg,13168,236,361,,1,2016-10-26T13:40:51,1477489251,,1,1652267890731515905,kay_dankl,84951490,1682766337,,,,,2023-05-02T10:31:00.369613,https://twitter.com/Holunderl/status/1652284259929817089,,,,,,,,,,,kay_dankl,84951490,
1652284189192978438,1682770223,2023-04-29T12:10:23,Stimmvoll,"@Daniel_Roetzer @TomMayerEuropa @svazek Ich darf sie hier nochmal höflich ans Wahlergebnis verweisen... Haslauer probiert, mit SPÖ und FPÖ eine tragfähige Basis zu bilden. Wenn die SPÖ das nicht will, was wir am Dienstag wissen werden, muss er eine andere Lösung finden. 🤷‍♂️",0,0,0,1,de,Daniel_Roetzer,55283925,1652282486414614528,,,Österreich,,,138747304,andante espressivo,0,"Sänger, Liebhaber von Klassik, Metal und gutem Whisky. Meistens zum Blödeln aufgelegt. Fantasy- und Sci Fi-Fan, RPG-Nerd.",,https://pbs.twimg.com/profile_images/1124681094694080512/ycIof3Bw_normal.jpg,9529,348,746,,9,2010-04-30T13:25:28,1272633928,,1,,,,,,,,,2023-05-02T10:31:00.369795,https://twitter.com/Stimmvoll/status/1652284189192978438,,,,,,,,,,,Daniel_Roetzer|TomMayerEuropa|svazek,55283925|547173846|1131147129215508480,
1652283717631524864,1682770110,2023-04-29T12:08:30,herbstdepressio,"RT @kay_dankl: 1) Einige Ideen, die nicht besonders links sind & sogar für d. ÖVP umsetzbar wären: Das habe ich diese Woche beim Empfangsgespräch mit LH Haslauer mitgebracht. Es war ein respektvoller Austausch, auch wenn uns weltanschaulich & wohnungspolitisch sehr viel trennt. @krone_salzburg https://twitter.com/kay_dankl/status/1652267890731515905/photo/1",0,0,0,0,de,,,,,,Wien,,,956437284,Shorty Short,0,Hier gibt es nichts zu lachen!,,https://pbs.twimg.com/profile_images/1650045711038181376/gRmfYOgs_normal.jpg,7261,173,32,,9,2012-11-19T00:06:28,1353283588,,1,1652267890731515905,kay_dankl,84951490,1682766337,,,,,2023-05-02T10:31:00.370127,https://twitter.com/herbstdepressio/status/1652283717631524864,,,,,,,,,,,kay_dankl,84951490,
1652283634030718978,1682770090,2023-04-29T12:08:10,DavinaShadows,"RT @kay_dankl: 1) Einige Ideen, die nicht besonders links sind & sogar für d. ÖVP umsetzbar wären: Das habe ich diese Woche beim Empfangsgespräch mit LH Haslauer mitgebracht. Es war ein respektvoller Austausch, auch wenn uns weltanschaulich & wohnungspolitisch sehr viel trennt. @krone_salzburg https://twitter.com/kay_dankl/status/1652267890731515905/photo/1",0,0,0,0,de,,,,,,,,,1608288800,Gela Baum,0,"A feminist is anyone who recognizes the equality and full humanity of women and men.
#Autismus #IchbinArmutsbetroffen #linksversifferGutmensch #singleMum",,https://pbs.twimg.com/profile_images/1544572043458379779/sw-MpVph_normal.jpg,8790,273,1196,,0,2013-07-20T13:46:49,1374328009,,1,1652267890731515905,kay_dankl,84951490,1682766337,,,,,2023-05-02T10:31:00.370370,https://twitter.com/DavinaShadows/status/1652283634030718978,,,,,,,,,,,kay_dankl,84951490,
1652282645093416960,1682769855,2023-04-29T12:04:15,vienna1011,"@mayer_wolfgang Das nennt sich Haltung und Anstand. Es liegt nicht an der SPÖ,  es liegt an Haslauer, der lieber mit Kellernazis arbeitet.",0,0,1,0,de,mayer_wolfgang,360559977,1651664571176742918,,,"Wien, Österreich",,,53666782,Andrea Seidl🇺🇦,0,"DGKP a.d.Front, Wissenssammlerin, Humanistin u. Animal-rights-Verfechterin,Sozialdemokratin aus Überzeugung, Hasskommentare,Trolle u. Neonazis werden geblockt",,https://pbs.twimg.com/profile_images/1600898307009777665/oYhj1ECw_normal.jpg,38323,887,655,,3,2009-07-04T13:18:22,1246713502,,1,,,,,,,,,2023-05-02T10:31:00.370561,https://twitter.com/vienna1011/status/1652282645093416960,,,,,,,,,,,mayer_wolfgang,360559977,
1652282435382517771,1682769805,2023-04-29T12:03:25,GenosseNaruto,"RT @kay_dankl: 1) Einige Ideen, die nicht besonders links sind & sogar für d. ÖVP umsetzbar wären: Das habe ich diese Woche beim Empfangsgespräch mit LH Haslauer mitgebracht. Es war ein respektvoller Austausch, auch wenn uns weltanschaulich & wohnungspolitisch sehr viel trennt. @krone_salzburg https://twitter.com/kay_dankl/status/1652267890731515905/photo/1",0,0,0,0,de,,,,,, 木ノ葉隠れ,,,1106905184314232832,渦巻鳴門 ☭ 🇰🇵🇨🇳,0,"DPRK PRC he/him Furry
#FreePalestine!
JUCHE GANG
🇨🇳🇨🇺🇰🇵🇵🇸🏳️‍🌈
❤️≠like, 🔁≠endorsement
共産主義者 공산주의자 Kommunist☭",,https://pbs.twimg.com/profile_images/1637158431743254528/rdYBQQz6_normal.jpg,51153,692,717,,6,2019-03-16T13:08:56,1552741736,,1,1652267890731515905,kay_dankl,84951490,1682766337,,,,,2023-05-02T10:31:00.370778,https://twitter.com/GenosseNaruto/status/1652282435382517771,,,,,,,,,,,kay_dankl,84951490,
1652282223079440385,1682769754,2023-04-29T12:02:34,RMogyorosy,"RT @kay_dankl: 1) Einige Ideen, die nicht besonders links sind & sogar für d. ÖVP umsetzbar wären: Das habe ich diese Woche beim Empfangsgespräch mit LH Haslauer mitgebracht. Es war ein respektvoller Austausch, auch wenn uns weltanschaulich & wohnungspolitisch sehr viel trennt. @krone_salzburg https://twitter.com/kay_dankl/status/1652267890731515905/photo/1",0,0,0,0,de,,,,,,"Wien, Österreich",,,1166245247640330240,Rinaldo Mogyorosy,0,Für die Rechten bin ich ein links-linker-rotgrün-versiffter Gutmensch. 🤪,,https://pbs.twimg.com/profile_images/1529043443053481984/ygEJ8xqr_normal.jpg,54203,9359,5965,,57,2019-08-27T07:05:29,1566889529,,1,1652267890731515905,kay_dankl,84951490,1682766337,,,,,2023-05-02T10:31:01.719542,https://twitter.com/RMogyorosy/status/1652282223079440385,,,,,,,,,,,kay_dankl,84951490,
1652281868140552192,1682769669,2023-04-29T12:01:09,IreneW1812,RT @m8ahr: Haslauer bietet Dreier-Koalition an - SPÖ blockiert. Langsam aber sicher zweifle ich echt an den Verhandlungskünsten der Sozialdemokraten. Das wäre die Möglichkeit für ALLE Salzburger:innen da zu sein. So werden sie halt 5 Jahre mit der KPÖ und den Grünen zuschauen müssen.,0,0,0,0,de,,,,,,Wien Landstraße,,,1182378068,Irene Wernicke 🇦🇹🇮🇱🇺🇦,0,"Verheiratet, 3 Söhne , 5 Enkelkinder, genieße das Leben",,https://pbs.twimg.com/profile_images/1580131011823894530/CR31KRJ__normal.jpg,269894,1337,819,,86,2013-02-15T12:30:10,1360931410,,1,1651890787905417216,m8ahr,1489998011107315715,1682676429,,,,,2023-05-02T10:31:01.719830,https://twitter.com/IreneW1812/status/1652281868140552192,,,,,,,,,,,m8ahr,1489998011107315715,
1651890787905417216,1682676429,2023-04-28T10:07:09,m8ahr,Haslauer bietet Dreier-Koalition an - SPÖ blockiert. Langsam aber sicher zweifle ich echt an den Verhandlungskünsten der Sozialdemokraten. Das wäre die Möglichkeit für ALLE Salzburger:innen da zu sein. So werden sie halt 5 Jahre mit der KPÖ und den Grünen zuschauen müssen.,0,11,71,50,de,,,,,,,,,1489998011107315715,Maximilian Bähr,0,Redakteur Zur-Sache / Angel 🎣 und LoL - Enthusiast / hier private Meinung,https://zur-sache.at/,https://pbs.twimg.com/profile_images/1532672283126423553/XKMgoNYX_normal.jpg,633,145,330,,0,2022-02-05T16:23:17,1644078197,retweet,1,,,,,,,,,2023-05-02T10:31:01.719802,https://twitter.com/m8ahr/status/1651890787905417216,,,,,,,,,,,,,
1652281846317699072,1682769664,2023-04-29T12:01:04,graueMaus8,"RT @Peter_Pilz: Parteibuchwirtschaft, Postenschiebereien im BMI - und mittendrin Dr. Wilfried #Haslauer, Landeshauptmann. @RedaktionZack hat einen neuen Akt - und die Mails, die den #ÖVP-Spitzenkandidaten schwer belasten. https://zackzack.at/2023/04/18/parteibuchwirtschaft-in-salzburg-falsches-spiel-mit-haslauer",0,0,0,0,de,,,,,,,,,1359947061609844741,graue Maus,0,,,https://abs.twimg.com/sticky/default_profile_images/default_profile_normal.png,257,13,40,,0,2021-02-11T19:27:54,1613071674,,1,1648320674170019840,Peter_Pilz,168482405,1681825247,,,,,2023-05-02T10:31:01.720308,https://twitter.com/graueMaus8/status/1652281846317699072,,,,,,,,,,,Peter_Pilz|RedaktionZack,168482405|1154374180642705409,Haslauer
